,si,gu,dong,name,address,review,label
454,서울특별시,광진구,군자동,스타벅스 군자역점,서울 광진구 천호대로 548,직원준들 친절하시고 2층에 테이블도 많고 넓어서 노트북들고 업무보기 편안했어요 스프랑 샌드위치 맛나네용 역시 스타벅스 직원분 너무 친절하구 예쁘셔요 토요일아침 기분좋게 시작합니당  자주 이용합니다 사람 많지만 매장 넓어요 오늘은 공부하러 왔는데 주변소음이 잔잔하게 있는게 좋으신분들은 좋을 것 같아요 그런게 아니라면 공부는 비추천 역바로 앞이라 사람이 많고 그만큼 매장도 넓어요 그럼에도 매장은 청결하고 직원분들은 친절하세요 수다떨러오기 굳  자리가 많아서 좋아요 케이크 포장했는데 빵시트가 메말라서 너무 퍽퍽해서 당황했네요 언제 만든 제품인지 샌드위치는 평범했습니다 매장이 깔끔합니당 스타벅스에서 고구마케이크 처음 먹어봤는데 맛있었어요 2층도 화장실도 모두 깨끗하서 잘 이용하고 왔습니다 새로나온 바질 레몬 샤벳 상큼하니 맛나네요 피지오 맛있어요 양 많이 주면 좋을듯 한입먹으면 훅 줄어요 샌드위치류가 타점포보다 다양하게 많이 진열되어있어서 좋았습니다 매장이 엄청넓고 뷰가 좋아요 공부할 때 자주 와요 사람이 많긴 하지만 또 자리가 많아서 괜찮아요 군자역 인근 사거리에 별다방 약속이 있어서 아주 잠깐 앉았다가 가려고 통신사 포인트로 따뜻한 아메리카노 주문했는데 원두 한방울 넣은느낌 맹물맛이네요 한달에 한번 통신사 포인트로 아메리카노마실때 있는데 장한평역점은 똑같이 통신사 포인트로 주문해도정말 너무 맛있는 커피주는데 이건 뭐 따뜻한 물한잔 마시고,"[1, 0, 1, 0, 1, 1, 0, 0]"
455,서울특별시,광진구,군자동,짐스하이드어웨이,서울 광진구 군자로 162 1층,메뉴들도 하나하나 다 맛있고블랙유자티 처음먹어봤는데 스파클링이 은은하게있는게 취저였어요 좋은 날씨  야외석  맛있는 음식   브런치 먹고 싶어서 방문했는데 커피랑 맛있게 먹었어요 가게는 조그마한데 아늑하고 넘 좋았어요 다음에 또 방문하려구요  아담하고 분위기 좋은 곳 커피와 주류를 늦은 시간에 함께 마실 수 있어서 더 좋았음 와인종류가 많지 않아 아쉽지만 사장님이 친절하시고 조용해서 좋아요 조만간 손님들이 많아질 것같아요 분위기도 좋고 커피도 맛나요 잠봉 무슨 샌드위치 시켰는데 샌드위치 바게트빵도 부드러우면서 쫄깃하고 샌드위치도 커피도 넘 맛있었음 여기 분위기 너무 좋아요 사장님두 친절하시구 노래도 좋구 무엇보다 하이볼이 맛있더라고요 이번엔 서울의밤 마셨는데 원래 짐스볼 마시는데 진짜 맛있어요 그리고 감바스두 맛있더라구요 음료그리고 디저트 그리고 인테리어그리고음악   이런게 공간이구나라는 생각이듭니다 여기 감바스 넘 맛있네요 딜 과 훈연파프리카  새우의 조합 넘 이국적 감바스 오일에 빵 찍어  싹싹 먹었어요 풀드포크도 향도 좋고 양파랑 소스도 너무 잘 어울렸습니다 양도 많고 감자튀김도 같이 나와서 든든하게 먹었네요  군자동의 행복입니다정말 커피도맛나고 편하게 와인즐기기에도 너무좋은 공간입니다 사장님 너무 친절하시고  커피도 너무 맛있어요   특히 오픈샌드위치 최근에 먹었던 것 중에 제일 맛있었어요  다음에 또 오고 싶을 것 같아요 데,"[1, 0, 1, 1, 0, 0, 0, 0]"
456,서울특별시,구로구,신도림동,아방 갤러리 카페 디큐브시티점,서울 구로구 경인로 662 현대백화점 디큐브시티 3층,디큐브시티 3층에 있어서 신도림역 주변을 한 눈에 볼 수 있어요 매장이 넓어서 창가 자리 말고 앉을 곳도 많고 갤러리카페라 구경하기도 좋습니다  카페모카 레몬진저 얼그레이 케이크 맛있게 먹었습니당  백화점에 위치해있어서 접근성 너무 좋고 카페 분위기도 진짜 이뻐요 창가자리 완전 추천 뷰가 진짜 너무 예뿌고 초록초록 합니다  벨로나리치초코 너무 맛있고 달다구리 레드벨벳케이꾸도 강추 매장도 너무 깔끔청결하고 디저트와 음료도 맛있어요 그리고 매장에 앉아서 디큐브도 한눈에보여서 혼자 멍때리거나 대화할때도 전망이 좋아서 자주자주 방문할예정입니다2 진짜 카페 깔끔해서 예쁘고 백화점 안에 있다 보니 쇼핑하고 쉬었다 가기 너무너무 좋네요  신도림역쪽 뷰가 탁트여서 보여서 날씨 좋은날에 꼭 또 오고 싶네요  그리고 진짜 여기 플랫슈패너 미쳤으니까 꼭 드세요 제발  카페라떼 부드럽고 고소해서 맛있어요 스텝들도 친절하고 실내이지만 유리창이 있어 답답하지 않고 분위기 밝고 편안해요 케이크가 맛있었어요   너무 달지 않고 고급스러운 맛 좌석도 많아서 편하게 잘 이용했습니다 아메리카노 위에 커피찌꺼기같은게 좀 있어요 처음엔 거품인줄 알았는데 기름인지 뭔지 가루같은게 윗부분에 있어요 밝아서 대화하기 좋아요 신맛원두에요 뷰는좋네요 공간넓고 맛있는 음료 디저트 맛볼 수 있네요 셤 공부하러왔어요 다른곳보다 가격이 비싸서 그런지 좌석이 있네요 좋은 자리 좋은 커피 비,"[1, 0, 1, 1, 1, 0, 0, 0]"
457,서울특별시,구로구,신도림동,히어로스터 본점,서울 구로구 경인로63길 21-8 1층 헤라시보리 옆 골목,처음 생겼을 때부터 애정하는 곳  다들 데려가면 “어디가” “이런데에 카페가 있어” 하지만 막상 가서는 예쁘고 좋다고 반하는 곳  인테리어 멋지고 아인슈페너 맛있는 곳   넘 좋아하는 곳이라 언제든 가고 싶을 때 그 자리에 있길 바라는 마음에 모르는 사람 없길 바라는 곳 신도림에 이렇게 좋은 카페가 있는 줄 몰랐어요 널리널리 소문내야겠어요 커피 너무 맛있어요 손님들이 많아서 좌석을 찍지는 못했지만 테이블도 많고 공간도 넓어요 커피향미가 참 좋아요 좋은사람과 대화나누기 괜찮은곳으로 추천 흑임자아인슈페너 진짜 맛있어요_ 하루에 두 번 방문했네요 친절하시고 커피도 맛있어요 가격 착하고 달달해서 맛있어요 여기 중국노래 틀어요 알바가 중국노래 선곡하는건지는 모르겠는데 아무튼 계속 중국노래나오더라구요  구로의 희망이었는데 하 평일 낮 조용하고 좋네요 숨겨져 있는 아는 사람만 아는 곳인 것 같아요 사장님 매우 친절하십니다 내부 구조상 안쪽 공간은 소리가 울려서 옆 테이블 대화 소리에 영향을 좀 많이 받더라구요 커피 마시기 좋은곳입니다 신도림에서 약간 느낌있는 카페 의외로 동네 어른들이 많아서 놀랬다  마음에 듬 지인과 잘대화나누다갑니다  커피가 맛있네요 좁은 통로라서 작을 것만 같았는데 생각 보다 크고 구조상 겨울엔 좀 춥고 특히 여름에 가기 좋을거 같아요 커피 향미 참 좋아요  음악도 마음에 들고 공부하러 왔다 분위기에 취하네요 아인슈패너 시켰,"[1, 0, 1, 1, 1, 0, 0, 0]"
458,서울특별시,구로구,신도림동,히어로스터 2호점,서울 구로구 경인로 620 1층,밖에서 보는것보다 내부 공간이 적당히 있고깜찍한 야외공간도 있어서 좋았습니다 호텔 바로 옆이라 주말에는 예식다녀온 손님들로 북적하긴 했지만 평일에는 시간보내기 좋아보였어요 커피도 맛있고 분위기도 괜찮네요 커피도 맛있고 인테리어가 너무 예쁩니다 그언데 전 커피 강한맛을 좋아하는데 약해요 강한맛 좋아하시는 분들은 샷추가 매장이 생각보다 넓고 깨끗해요 디저트랑 음료도 맛도리 2호점 방문했는데 브런치플레터도 맛있고  인테리어 너무 예쁘네요_♡ 분위기좋구 커피맛있어요 오픈한지 얼마 안되서 그런지 깔끔하고 좋은데 새거 냄새는 너무 나요 페인트냄새 분위기도 좋고 직원분도 친절해서 좋네요 커피넘 맛있고 외부공간도 좋아요 쇼콜라 케이크 준맛 잘먹고가요  라마다호텔옆이라 사람이 많네요 혼자보다는 여럿이 가면 좋을곳 자리가 많구 야외자리도 있어서 아이랑도 가기 좋을것 같아요  인테리어한지 얼마 안된건지 실내에서 페인트 냄새가 좀 나지만 넓직하고 예뻐용 야외테이블도 있어요 사장님이 친절하고 커피도 맛있어요 카페 내부도 깨끗하고 좋네요 커피한잔하며 대화하기 편안한분위기요 넓고 캠핑 느낌 나는 자리 많네요 새로생긴지 얼마안되어서 깨끗하고 커피맛도좋아요 아인슈페너 죽임,"[0, 0, 1, 1, 1, 0, 0, 0]"
459,서울특별시,구로구,신도림동,스타벅스 신도림점,서울 구로구 경인로 610,트리플에 꽃혀서 선택하고 다른 샌드위치도 추가하고 마카롱이랑 쨈도하나 추가하여 선물로 받은 쿠폰을 사용했어요 우리 동네에 스타벅스가 몇군데 있는데 그중에 여기도 친절하고 커피와 빵이 맛나요 시원한 아이스 커피 마시며 시간 즐기기 좋아요 구로역과 신도림역 사이에 위치한 점 때문인지 다른 역 주변이나 사무실 밀집 지역에 위치한 스벅보다 조용합니다 10분이상 걸어가야해서 음료푸드 전체포장으로 주문하는데 매번 포장이 달라요  언제는 음료는 그냥주고 언제는 텀블러쇼핑백에 푸드주고 언제는 쇼핑백에 푸드음료 같이 주고 이게 제일 좋아요     통일성있게 부탁드립니디 콘센트가 많이 부족합니다 안쪽의 자리만 콘센트가 있는데 그 중에서도 가운데 자리의 콘센트가 고장났어요 플러그가 제대로 물리지 않아서 충전이 안됨 저녁 할인으로 푸드류를 구입 할 수 있어 좋음 직원분들이 항상 친절해서 방문할때마다 기분이 좋은 매장 커피가 맛있네요 친절해요 케이크 맛있어요  브레드 종류 더 많았음 좋겠어요  라떼 시키면 하트 그려줘서 좋아요 의자가 딱딱해서 조금 불편했고 화장실이 외부에 있는데  청결해보이지 않았어요 아이스 아메리카노는 쓴맛이 느껴졌어요 라떼는 맛있었다네요 신도림점 스타벅스 신도림역과 구로역사이에 위치해있는 스타벅스 현재 건물이 공사중이지만 스타벅스는 운영하고있어요  공사중이라고 놀라지마세용 매장도 넓고 직원분들도 너무 친절하세요 화장실은 매장밖으로 나가,"[1, 0, 1, 0, 1, 0, 0, 0]"
460,서울특별시,구로구,신도림동,삼구칠,서울 구로구 신도림로 25 1층,커피 특히 처음이라 먼저 아메리카노를 기본으로 고소함을 선택했죠 이곳이 파리인지 케냐인지 아 완전 행복합니다 커피의 목넘김이 완전 훌륭합니다 다음에는 핸드드립을 맛보려구요 크라샹은 파리에서 매일 아침 먹던 그 따뜻함이 기억나게 하며 너무 맛나더군요 하나 더 샀어요 옆집 친구 사다 주려구요 또 오게 하네요 홀은 높고 넓직해서 와서 커피 마시고 있다가기 좋으네요 행복해요 2023년 4월 18일 동네주민 한사람 오늘은 작정하고 핸드드립을 마시러 왔어요 크라샹은 역시나 한꺼플씩 까플을 벗으며 저의 입안으로 혀끝으로 와주었어요 세느강을 거닐던 그때가 마악 생각나네요 이제 코로나도 잠잠하니 파리에 에펠타워를 보러갈거나 그래도 그전에 여기 크라샹과 커피맛때문에 당분간은 나의 발을 여기에 묶어둘 예정일거같다 아래 리뷰들에 보니 초기에 조금 시끄럽고 어수선하다고들 하셨는데 그런분들께 한 번더 추천해 본다 여기를 우리 신도림의 커피 성지로 만들어 보면 어떨까 커피애호가들이 찾고 빵 애호가들이 찾는 우리의 삼구칠은 계속 기대가 된다 근처에 있는 구로 기적의 도서관에 들러서 원하는 책을 하나 픽하여 들고 자박자박 걸어와서 고단함을 커피 한 모금으로 목으로 넘기고 백색소음에 귀를 내맡겨 시름 끝 집 앞에 카페가 오픈했어요 실내가 아주 이색적입니다 빵도 맛나요 조용하기도 하고 디저트도 맛나서 자주 이용할거 같습니다 동네에 멋진 까페가 생겨 너무 좋아요 집 근,"[0, 0, 1, 1, 1, 1, 0, 0]"
461,서울특별시,구로구,신도림동,스타벅스 현대디큐브B2점,서울 구로구 신도림동 360-50,점심 저녁 피크시간만 빼면 사람이 많이 없어서 좋아요 파트너분들도 너무 친절하시고 커피도 늘 맛있어요 얼른 슈크림라떼가 나왔으면 젛겠어요 신메뉴 딸기라떼 먹었는데 묽은 요거트  딸기맛이라네요 아기랑 같이 갔는데 컵이 필요해서 부탁드렸어요 아기빨대랑 아기컵 같이 챙겨주셔서 좋았어요 이번 시즌 얼그레이 바닐라 라떼 맛있어요  이브닝 할인으로 먹으니 더 맛있어요 용과리프레셔 주문 특이한 맛이네여 ; 커피도 맛있고 직원분들도 친절해요 오랜만에 슈크림라떼 맛있게 먹었어요♡ 7시 이후 푸드 50를 놓칠수 없죠 비오는 날 뜨끈한 아메에 얼그레이 초코 케잌 먹으니 기분이 좋아지네요♡ 디큐브시티 스벅 오후7시 부터 디저트 할인해서 혜택받았어요굿 7일인가 8일까지 행사하는것 같아요 슈크림 라떼를 처음 주문해 봤습니다 달달하고 맛있긴 한데 저한테는 살짝 단맛이 강해서 다음엔 무난한 아메리카노로 가야할 것 같습니다 새로운 메뉴를 시켜보았는데 실패했어요 시간을 떼워야 되서 많이 먹긴 했습니다 허허 900 넘어 퇴근할 때 열린 곳 고민하다가 오늘 밤 샐수도 있어서 신메뉴 득템베리인데 수박맛이 난다 파트너님들 많이 바쁘셨나봐욥  맛있는 슈크림 라떼 봄맞이 슈크림 라떼에 카라멜드리즐 추가 봄비내리는 오늘 뜨아마시러 우산쓰고 나오는 나만의 낭만법 출장가면서 잘마시고 가네요 단호박보늬밤 맛있어요 브라운 슈가 오토 쉐이큰 에스프레소 커피 맛이 좋아요 생일쿠폰사용했지요,"[1, 0, 1, 0, 0, 0, 0, 0]"
462,서울특별시,구로구,신도림동,폴바셋 현대백화점 디큐브시티점,서울 구로구 경인로 662 디큐브시티 5층,폴바셋 봄말차 존버하다가 드디어 먹어봤는데 예상 외로 찐한 말차맛은 아니더라구요 녹차맛은 은은한 편이고 우유맛이 더 많이 느껴졌어요 제가 쌉싸름한 말차파라 더 그런 걸 수도 있겠지만 불호이신 분들도 충분히 드실 수 있을 것 같아요 저도 아이도 좋아하는 폴바셋♡ 너무 맛있어요 맛있었어요 첫 아이스크림 개시 녹차 아이스크림 맛있어용 크기는 작고귀여움 군고구마 양갱이 한번 사먹었는데 아이스크림에 조각내서 같이 먹어도 맛있었어용 커 피 음 료 맛 나요   주차  편리 즐겨가는 폴바셋에 맛있는 아이스크림과 소화잘되는 우유로 카페라떼 마셨는데 좋네요 배도 덜아프구요 우주 할인 받으니 더 좋네요 공간이 엄청 크진 않지만 친구와 대화하기 좋아요 아이스크림라떼 맛있어요 사랑은 아아아아아아아 아이스크림 짜잔 역쉬 커피는 폴바셋이 젤 맛나요 근데 빵은 제 값을 못하는 듯 해요 단팥은 그럭 저럭 맛난데빵부분이 조금 딱딱해요 맛있으면 괨찮은데 빵부분이 별로 였어요 사람 만나기 편한 곳이에요 호박식혜를 시켰는데 호박맛이 하나도 안나요 색깔도 메뉴판에는 노랑인데 그냥 식혜색깔이고 지나다가 들렀어요 백화점 안에 있어서 쇼핑하다 가기 좋아요 엄청 친절하세요 먹다가 중간에 찍었습니다 매장이 조금 아쉽긴 하네요 그래도 친절하시고 빠르게 음료 나와서 잘 먹고 갑니다  라떼는 폴바셋  오트로 먹으니 고소하네요 대화하기 좋고 커피맛나요 바닐라빈 카페라떼2 카페라떼1 말차라,"[1, 0, 1, 0, 0, 0, 0, 0]"
463,서울특별시,구로구,신도림동,슈퍼말차 디큐브시티,서울 구로구 경인로 662 디큐브시티 B2,더티콘 진하고 부드러운 녹차맛에 코코넛이 아주 잘 어울려요 남자친구님은 코코넛 맛이 더 많아서 살짝 아쉬웠다 했어요 그래도 완전 매력적인 녹차코코넛 조화 블랙롤케이크 중간에 크림 많은 부분은 촉촉하고 맛있었는데 크림이 적은 부분은 조금 아쉬웠어요 진한 녹차맛보단 옅은 느낌이라 입문자분들이 좋아하실거 같아요 위에 초코코팅은 꾸덕한 느낌인데 어느정도 포인트는 되지만 케이크와 조화가 훌륭하진 않았아요 그래도 글루텐프리라서 속 편하게 무난하게 먹었어요 공간 앉아서 먹을만한 곳이 세 테이블옆에 넓은 공간은 음식점 고객 공간이더라구요이라 협소해요 의자와 테이블이 높아서 편하진 않아요 보리라떼 은근 중독이예요 맛있어요 직원이 친절하진않음  음료는 맛있었지만 뭔가 불친절해서 기분이 썩 좋진않음  특히 만들어주는 분 세상 귀찮음 에너지 뿜뿜 보통 카페가서 얼음 빼달라고하면 양이 적어진다고 물어보고 만들거나 가득채워주거나 하는데 여긴 그런거 없음 걍 만들어놓고 먹으라함   아이스크림은 생각보다 밍밍하고 별로였고  코코넛밀크베이스로한 말차라떼는 맛있었음 말차 너무 좋아하는데 뒤에 텁텁함도 없이 깔끔하네요 당도는 좀 있는 편인 거 같고요 음료 양은 많지 않지만 말차라떼 맛있네요 디큐브시티 지하매장이라 테이블은 몇개없어요 직접 눈 앞에서 제조해주는데 너무 맛있어요 아이스크림 꿀맛입니다 오우 맛있었어요 말차 맛집 성수동 핫플인데 가까운 곳에도 있어서 넘 좋네,"[1, 1, 1, 0, 0, 0, 0, 0]"
464,서울특별시,구로구,신도림동,투썸플레이스 신도림디큐브시티점,서울 구로구 경인로 662,뮤지컬친정엄마를 엄마 모시고 보러갔다가 뮤지컬 좌석 예약하고 1시간 시간이 남아서 투썸플레이스에 갔습니다 선물받은 커피쿠폰이 있어 과일쥬스로 주문하고 차액 추가 지불했습니다 주문받은 여직원분 일 잘하더라구요 자몽오렌지 쥬스 역시 찐했구요  키위바나나 쥬스도 맛있었답니다 울 엄마께서 비오는 창밖보시며 레몬파운드케잌 드시며 흡족해하셔서 늦게라도 리뷰 씁니다 칭찬해요투썸♡ 약간 쌀쌀한 날 따뜻한 차와 마들렌과 빵 마들렌 마들렌 맛있는 마들렌 언제나 좋은 경치 추천 디저트 티라미수 마들렌 콤부차 좋아하는데 맛나요 케이크 종류가 많아서 좋아요 신도림역 투썸플레이스 현대백화점 2층 야외에 위치해있는 투썸 통유리로 매장이 살짝 추웠어요 그래도 음료도 맛있고 디저트도 맛있는 투썸 따로 화장실은 없고 백화점 화장실 이용가능 맛있는 커피에 아이스박스 는 최상의 조합이죠 오늘도 기분좋은 시간 보냈습니다 밀크티와 독서 힐링 투썸밀 이용하면 저렴히 먹을수있어요 새로 나온 또먹는바닐라슈크림 시켜봤는데 슈 안에 크림은 없네요  반전매력인가 근데맛있어요 신도림에 12시까지 하는곳은 여기뿐  늘 자리가 없을 수도  사람 많음 다른 커피숍은,"[1, 0, 1, 0, 1, 0, 0, 0]"
465,서울특별시,구로구,신도림동,띵크커피 디큐브시티점,서울 구로구 경인로 662 현대백화점디큐브시티점 지하1층,공간이 넓고 커피가 진해요 띵크커피 흔하지 않은데 신도림역에 오래 있네요 지하철역에서 가깝고 백화점으로 이어지는 초입에 위치해서 접근성 좋아요 뻥 뚫린 공간이라 답답함도 없고요 커피와 음료는 평범하고 페스트리나 케익은 가격 대비 별로라고 생각해요 수다 떨거나 업무하기 괜찮은 공간 조용해서 대화나누기 좋아오 먹느라 사진을 못찍었지만 커피 잘 마셨습니다  다만 카페가 오픈되어 있어서 시끄럽다보니 대화하기는 조금 힘들었습니다  음료는 그냥 먹을만하고 화장실 이용은 많이 불편해요 잠시 머물러가기 좋아요 커피맛은 제입엔 안맞지만 친구는 맛있다고 하네요 알바가 아침이라 무표정에 친절 하진 않아도 커피는 맛있네요 커피 괜찮더이다 커피한잔에 여유 친절하진 않아요 친절하진않지만 커피는 맛있어요 좋아요 맛있어요 매장이넓어서 좋앙 친절하고 커피도 맛있어요 커피가 맛있어요  커피가 맛있쏘요 대화하기 좋은 곳입니다 신도림 현백 안에 유일하게 자리가 있어서 두번이나 들어감 커피가 맛났던 기억 조용하고 좋아요 커피맛은 그냥 그렇지만 얼그레이 케이크는 맛있었어요  큐브라떼 맛있네요 좋아요 매장 안이 추워요 믿고 마시는 띵크커피 더 많은 지점이 생겼으면 백화점보다 일찍 열어요 머핀이 맛있어요 친절하시고 좋아요 직원분 친절하세요 칸막이도 잘해두셔서 좋네요 창가 자리는 추워요 역이랑 가까워요 많이 안북적거려서 좋아용 남는 공간에 임시로 차려둔 것만 같은 인테리어인데 ,"[1, 0, 1, 0, 1, 1, 0, 0]"
466,서울특별시,구로구,구로동,메이비카페,서울 구로구 디지털로32나길 51 1층 메이비,브런치하면 메이비카페  구디하면 메이비카페 구디 대표카페 다운 브런치 가격도 저렴하고 양도 많고 맛도좋고 무엇보다 요즘 날씨에 테라스에서 먹기에도 너무 좋아요  친구 데리고 왔는데 반해서 갔습니당 단골카페 중 하나에요 오랜만에 점심회식 요리가만 많아서 늦게 나올 줄 알았는데 생각보다 빨리 한 번에 나왔어요  요리  음료 시키면 각 요리 당 음료 1000원 할인되네요 나름 저렴하게 먹을 수 있었어요 베스트 딱지 붙은 음식 말고는 쏘쏘 구디 역 바로 앞 대형 브런치 카페라 점심시간에 가면 직장인들 엄청 많고 넓고 쾌적해요 가격대는 조금 있지만 브런치 메뉴도 다양하고 빵 케익 등 디저트 종류 엄청 다양해서 빵구경하느라 바빠요 에그타르트랑 커피 맛집이에요 원두가 진하고 맛있어요 자리는 워낙 많아서 자리 걱정은 없고 테이블 간 간격이 넓어서 좋았어요 빵들은 빵 덮개가 각각 덮여 있어 먼지 탈 걱정이 없고 관리가 잘 되어있는 느낌을 받았어요 직원분들도 많고 화장실도 깨끗해요 육쪽마늘빵 안에서 이물질흰색코팅된 종이가 나왔어요 씹다가 모르고 그냥 삼킬 뻔 했는데 뱉으니 저런 포장종이 같은게 빵 안에 있더라구요  빵을 구울 때 들어간건지 나중에 들어간건지는 모르겠지만 놀라고 어이없고 황당했습니다 매장이 넓고 베이커리류가 많아요 브런치 메뉴도 다해서 카공하기 좋은 장소입니다 에그베네딕트는 딱 적당한 간과 완벽한 수란이 올라가서 맛있어요 베이컨이랑 스피,"[0, 0, 1, 1, 0, 0, 0, 0]"
