,si,gu,dong,name,address,review,label
224,서울특별시,강북구,번동,카페두두,서울 강북구 도봉로98길 56,수제로 된 메뉴들도 많았고 무엇보다 맛있었어요 의자도 편하고 아늑한 밖에 산책로도 있고 주차하기도 편하고 사장님도 친절하시고 카페 가게 되면 꼭 꼭 다시 가고 싶은 곳 커피도 맛있고 분위기도 편안하고 좋네요 우이천 산책하다 들르기 좋은 따뜻한 느낌의 카페입니다 사장님도 친절하시고 커피나 차 종류 떡볶이도 맛있어요  음료가 맛있고 베이커리도 종류가 다양하지는 않지만 알차고 맛있었어요 깔끔하고 케이크 맛있어요 그리고 차가 엄청 고급지네여 번동에 위치한곳 확트윈 탄천앞이라 좋아요 봄에는 벚꽂보러 가을에는 낙엽보러 종종 커피마시러갑니다  오랜만에 갔는데 라떼아트가 넘이쁘고 맛도 있어요 아메리카노4000 고구마라떼 4500  테이블이 넉넉하게 있어서 좋아요 여기 떡볶이 맛집인데 오늘은 레몬타르트 따뜻한 아메리카노 맛있어요 10시까지라고 써있는데 9시반에 마감이라고 해서 나갔어요 저번에는 9시반에 마감이라 해서 10시전까지만 나가면 되는줄 알았는데 그땐 화장실에 약뿌려놨다고 화장실도 못가고 나감 930 마감이라 생각하고 가야하나봐요 우이천 산책하다가 가기 좋은 커피숍  커피도 맛있고 케이크도 맛있어요 오늘은 수제쿠키를 먹어봤는데 견과류초코가 들어가서 맛있었어요 수제크림 음료 굿굿 친절하고 주차까지 되어서 좋아요 크림라떼도 맛있어요 여사장님은 처음 뵈었는데 유쾌하십니다 딸기라떼도 여전히 맛났구요 쾌적한 실내공간도 창 편안합니다 더욱 더 번창하세요,"[0, 0, 1, 1, 1, 0, 0, 0]"
225,서울특별시,강북구,번동,어셈블,서울 강북구 한천로 1007 1층,수유에 카이막 파는 곳이 있다고 해서 방문했어요 카이막은 처음 먹어보는데 토스트에 꿀이랑 같이  발라 먹으니 너무 맛있네요 순삭이예요 그리구 유자레드티도 많이 달지 않고 짱맛이예요 어셈블수유 강북구에 약속이 생겨서 카페를 찾다가 생각난 어셈블 직장이 수유였을 때 공사하시고 오픈하고도 종종 스쳐갔었는데 방문하기는 처음이네요 일행이 이미 카이막 토스트 에 대해 알고 있어서 두근두근하며 토슷흐 하나 커피는 각각 차가운 아메리카노 카페라떼를 주문했어요 메뉴판엔 다양한 커피ᆞ음료ᆞ디저트가 있으니 참고하시면 좋을 것 같아요 내부 인테리어는 입구에 있는 조경 우드시멘트톤이 만나 모델하우스를 놀러온 기분이랄까요 카페라기보단 잘 정리된 집에 온 느낌이었어요 그래서 오히려 편한 분위기에서 먹는 기분이라 더 맛있게 느껴졌어요 궁금했던 카이막은 제 입맛엔 꾸덕한 생크림이라 너무 만족스러웠는데요 만들긴 까다롭고 귀찮아서 이렇게 가끔 어셈블에서 사먹어야 겠어요 집 근처에 카이막맛집 어셈블이 있어서 방문을 하였는데 주말에는 역시 웨이팅이 있어요 카이막치아바타  카이막토스트가 있는데 카이막 입문으론 토스트를 많이 먹는다고 한다 카이막 맛평가  굉장히 크리마한 달달한 버터를 먹는 듯한 맛 토스트와는 역시나 잘어울린다 바삭함도 괜찮은 편 유자레드티도 달콤새콤해서 입맛에 맞았다 아이스아메리카노는 산미와 고소한의 중간 평범한 맛 카이막 처음 먹어봤는데 맛있어요  커피랑,"[1, 0, 1, 1, 0, 0, 0, 0]"
226,서울특별시,강북구,번동,앵두나무카페,서울 강북구 덕릉로40다길 33-38,사장님도 친절하시고 좋아요 종종 멍푸치노도 시키는데 강아지가 숨도 쉬지 않고 마실정도로 좋아해요 요즘 가기 좋은 계절인거 같아요 반려견카페 음식도 맛있어요 오패산 산책하고 종종 가고 있어요 주말에 비해 평일에 강아지들이 많지 않아서 좋아요 대형견존도 따로 있어서 큰 강아지들이 가기 좋을거 같아요 오패산 산책하고 가기 좋아요 종종 들려 커피 마시고 멍푸치노 사서 강아지 주는데 너무너무 좋아해요 여기 수제버거는 꼭 먹어야해요 버거맛집 요기요에도 있어서 종종 배달시켜먹어요 햄버거랑 파스타랑 맛있어요 반려견과 같이 가기 좋아요 국물떡볶이 로제파스타 다 맛있어요 애견 데리고 오기 좋은카페에요 애견카페인것같은 애견동반카페 메뉴들도 저렴해서 좋아요 실내보다는 실외 자리가 좋네요 주차는 가능하지만 사람들이 많이 몰리면 주차가 좀 힘들 수도 있겠어요 그래도 서울에 이런 카페가 있다는게 넘넘 좋네요 최애맛집 햄버거도 맛있는데 파스타도 진짜 맛있어요 좋아요 자주와요 가서 점심해결디저트해결    몇시간을 논건지 나만 알고싶은곳이지만 워낙 유명하나 너무 좋아요 요기 진짜 너무너무 좋은곳 벌써 2년째가구있어요  사장님도 친절하시구 아이들 다 기억해주시고 너무좋습니다 서울근교로 안나가도 이런 곳이 있어서 좋네요  공기 좋고 뭔가 탁 트인 곳이였어요그리고 의외로사장님도 친절하셔서 더 좋았어요 음료 가격도 이정도면 터무니 없는 가격도 아니고 맛도 괜찮은편 반려견,"[0, 0, 1, 1, 0, 0, 1, 0]"
227,서울특별시,강북구,번동,스타벅스 수유역점,서울 강북구 도봉로 342,신메뉴 아이스 슈크림 라테 주문했어요 샷이 하나라 커피맛이 많이 안나네요  아주 달달 합니다 잘못보면 아이스크림라테인줄 좋아하는케익 커피 마시는것보단 전 케익선호도가높은것같아요 수유역근처 라 자주방문하게되네요 언제나사람이많은곳이라 대부분포장으로 디저트좋아하는지라 자주가게되요 쿠폰도이용하고 카드할인도받고 굿 어니언치즈베이글 넘모 맛있아여  비가 오니 우산안쓰고 지하철옆에 가까워서 들어갈수있으니 편햐요 팬티사이즈로 샀는데 맛이 너무 연해요 샷 추가해야겠어요 새로나온 슈크림라떼 진짜 맛있었습니다 추천 매장이 깔끔하고 분위기가 좋아요 주말 오전 파트너들 친절해요 수유역 인근 별다방 봄이 왔네요  슈크림라떼 등장 수유역 인근 별다방 수유역 인근 별다방 친절하고 매장 깔끔해요 좌석은 그렇게 많진 않지만 자주 가는 곳이에요 대화하기 좋아요 매장이 깨끗해요 슈크림 라떼를 너무 맛있어 해요 딸이 기념품이 다양해요 친구들과 스벅에서 케익과 딸기라떼를 넘 맛있네요 딸기도 많이 씹혀요 원액 그대로 이곳 투샷은 벤티일뗀 좀 싱거워요 수유역 인근 별다방 테이블이 하나씩밖에 없어요 크지 않아서 2인용좌석위주로 이루어져있어요 다른 스타벅스랑은 다르게 영업시간이 11시 까지라 좀더 오래 머물수있는데 문제는 매장이 좁고 좌석도 적어서 오래 있고싶어도 그럴수가 없는 환경임 화장실도 여자화장실만 있고 남자화장실은 밖에 나가서 지하 수유역이나 근처 다른 가게 화장실을 이,"[1, 0, 1, 0, 0, 0, 0, 0]"
228,서울특별시,강북구,번동,수유가배당,서울 강북구 한천로132길 11 1층,기존에는 다른 카페자리였는데 가배당으로는 작년 7월에 오픈했다고 하네요 아기자기하게 예쁘게 꾸며져있고 음악도 산뜻하고 기분좋은 멜로디로 나와서 좋아요 요즘엔 가요보다는 멜로디만 있는 음악이 좋더라구요 지역카페만의 편안한 분위기가 좋고 사장님도 친절하시고 커피도 맛있네요 재방문의사 있습니다 지나면서 보기만 하다가 언니랑 들어가봤네요  청귤청은 많이 달지 않고 알싸한 맛이 좋았어요 그런데 컵모양이 일자가 아니고 청귤이 동그랗게 썰려 있어서 저어서 먹기가 조금 힘들었어요;;;   아메리카노는 진해서 진한 커피 좋아하시는 분들 마음에 드실 것 같아요  아기자기한 소품들이 많아서 어머님들이 아이들 주려고 많이 구매 하시더라구요 구경하는 재미가 쏠쏠 합니다   사장님도 친정하시고 다음엔 다른것 먹어보러 또 방문하려구요 사장님이 친절하시고 커피류가 진짜 맛있어용 강아지도 같이 올 수 있어서 좋아요 뭔가 80년대 한국 빈티지스러운 레트로 카페에요 커피맛집이어서 이름도 가배당 인가봐요 담에 또 올게요 할머니랑 같이 와서 든든하게 먹고갑니다 말차라떼는 크림이 엄청 꾸덕꾸덕 너무 맛있었습니다 딸기 라떼는 진짜 생딸기 그리고 건조딸기도 위에 올려주셔서 씹는 식감이 좋았어요 포근하고 따뜻한 느낌이고 당고도 직접 구워먹는 재미가 있었어요 리뷰보니까 애들 데리고 오는 경우도 있었는데 그런 이유가 있네용 너무 즐겁게 있다가 갑니다 외국인 친구들이 좋아합디다 가게,"[0, 0, 1, 1, 1, 0, 0, 0]"
229,서울특별시,강북구,번동,델디아,서울 강북구 오패산로 396-1 1층델디아,직원분께서도 무척 친절하시고 음료도 너무 맛있어요  함께온 엄마도 엄청 좋아하시네요♡ 감사합니다 생딸기빙수 크로플에 반해서 배달로만 주문하다가 찾아봤는데 가까운 곳에 있더라구요 방문했을때 사장님도 정말 친절하시고 카페두 아늑한 분위기라 넘 죠아써요 델디아 디저트는 언제 먹어도 감동이네요  음료도 진짜 강추입니다 항상 너무 맛있어요  배달로도 가끔 주문해 먹어요 카페 인테리어도 너무 예쁘네요  또올게요♡ 오늘 오랜만에 다시방문 카페안에 오늘도 빵내음 너무 좋은걸요  두번째 방문 이젠 수유리오면 방문하게 될거같아용  사장님도 엄청 친절하세요 첫방문인데 커피맛있어요 친절하시고 매장도 깔끔하고 크로플도 짱 커피가 맛있네요 점심먹고 바로가서 디저트는 못먹었네용 빵내음도 좋고  옆테이블에서 딸기핑수 먹는거보니 담에 꼭 먹으러 와야할듯 델디아 빙수 짱짱맨 진리의 눈꽃빙수 큰손이시라 팥 조금만 달라고 말씀드렸는데도 꿀맛이네용ლ´ڡლ 오래오래 번창하세효 크로플 메뉴가 다양해서 고르는 재미가 있고 맛있네요음료도 맛있고 사장님도 친절하셔서 좋네용 매장이 편안하고 즐겁게 수다도 떨고 직윈분이 친절하세요 빙수파는 카페라 너무 좋아요 빙수그릇도 넓어져서 좋고 달달하고 맛있어요 매장도 아늑하고 좋습니다 요 근처에선 가장 다양한 메뉴를 판매하는것 같아요 직원분들도 친절해요 처음 방문해봤는데 매장도 너무 깔끔하구 직원분도너무 친절하시구 크로플도 겉바속촉에 음료도 ,"[1, 0, 1, 0, 0, 0, 0, 0]"
230,서울특별시,강북구,번동,할리스 수유사거리점,서울 강북구 도봉로82길 11,카페에서 라이스를 먹은것은 처음 무슨 혼자 조식 먹는기분 생각보다 양이 적어서 딱좋았다 맛도 괜찮았다 4층도 좋네요 여직원이 친절해서 좋다 음악은 누가 정했는지 왜이리도 좋은걸까 수유 할리스 너무 편하고 분위기도 차분해서 자주 이용합니다 좌석도 다양하고 늘 친절해서 좋아요 추천합니다 입구에서 느낄수 없었던 들어가보니 너무 좋은 창가자리 눈이나 비올때 거기 앉아있고싶다 맛있는라떼 평소에는 주로 다른 프랜차이즈 브랜드를 많이 이용하는 편이지만 할리스커피 바닐라 딜라이트 너무 좋아해서 할리스도 꾸준히 방문하는 편입니다  다른 지점들 갔을때는 매장 직원분들이 불친절한 경우를 몇 번 겪어서 할리스 이미지에 타격이 있었는데 여기 지점 직원분들은 친절하셔서 개인적으로 애정하는 매장이에요  음료는 맛있구요 직원분은 친절하시네요 좌석이 편해서 오래 머물며 대화하기 좋아요 디카페인데도 맛있어여 할리스도 케이크 종류가 꽤 다양한데 투썸이랑 비슷한 케이크가 많네요  제주말차할리치노 넘 맛있어요 바닐라딜라이트 마시고 싶을때는 할리스로가요  맛있어요 다음에 또 올게요 제주 시즌 음료 주문해봤어요 제주 골든키위 스무디 예쁘게 데코해주셨어요 수유 중심에서 좀 떨어져서 그런가 조용한 편이고 좋아요 조용하니 좋습니다 딸기치즈케이크할리스 아이스 바닐라라떼  커피와 음료 역쉬 맛있어용 인증샷을 안찍었네 항상 친절해서 자동으로 들어가게되는곳 꽃카롱 안가져왔다 뜨악 회사근,"[1, 0, 1, 0, 1, 1, 0, 0]"
231,서울특별시,강북구,번동,번동숲속카페,서울 강북구 오현로 199-17 102호,가게 전체를 차지하는 통창이 매력적인 카페 애견동반도 가능한 매장 들어가자마자 마스코트인 사장님의 귀요미가 반겨주는곳 단남성분들 많이 경계하는 아이입니당 커피도 맛있고 디저트류도 가성비 짱이고편하고 이쁜 동네 카페임돵 음료도 맛있고 뷰도 좋고 멍때리기도 좋고 원래 애견카페 잘 안가지만 강아지도 순해서 시간 되면 또 가보려고 합니다 하지만 그 중에 단점은 주차가 제일 단점 이지만 그 부분만 빼면 만족 합니다 좌석이 편해 자주 방문하는 카페입니다 음료랑 디저트도 맛있어요 집근처에 갈만한 카페가 없어서 고민했는데 드디어 찾았네요 분위기 너무 좋아요 시간날때 와서 과제하기도 좋구 친구들이랑 와서 수다 떨기도 너무좋습니댜 커피랑 빙수 먹었는데 너무 맛있었고 사장님도 너무 친절하셔서 기분 좋았습니다 앞으로 자주 방문하려구요감사합니니댜 여기 라떼 진짜 맛집입니다 쿠키도 정말 맛있어서 잘어울려요 매장이랑 화장실이 너무 깔끔해서 좋아요  강아지도 너무 귀여워용  조용하고 깔끔한 카페에 음료와 샌드위치도 맛있었어요 강아지도 귀여워요  경치가 좋아서 나중에 혼자 힐링하러 또 오겠습니다 커피도 너무 맛있습니다 고소한맛 제 취향 다른메뉴도 많은데 궁금해지네요  편안하고 좋아요 매장 분위기가 너무 좋고 깔끔해서 너무 좋았습니다사장님도 너무 친절하시고 음료와 디저트도 너무 맛있어서 재방문 의사가 너무너무 다시 생기는 가게였습니다가게에 사장님 반려견도 너무 순하,"[0, 0, 1, 1, 1, 1, 0, 0]"
232,서울특별시,강북구,수유동,무너미,서울 강북구 노해로8가길 40 1층,특이하고 예쁜메뉴가 많아서 눈이 즐거웠어요 딸기 오레오 먹었는데 고급지고 담백한 돼지바 맛이라 맛있게먹었습니다  커피도 고소한맛이라 케이크랑 잘 어울려서 좋았어요 수유에서 젤 좋아하는 카페 케이크 언제 먹어도 맛있고 다양해서 좋아요 부모님도 좋아하셔서 자주 찾게 되는 무너미 부디 맛 변치 말고 오래오래 장사해주세요 사장님 사장님 지인 하고 싶은 맛입니다 무너미는 케이크가 독보적 비주얼입니당  황치즈 케이크 먹었는데 꾸덕하고 안에 찹쌀떡도 있어서 식감도 재밌었어요 케이크 먹으러 또 오고 싶어요 인스타에서 케익에 보고 반해서 찾아갔는데 독특하고 예쁜 케익 종류 많고 맛도 있음 다만 색이 엄청 원색인 케익들은 색소 뭐 쓸까 궁금해지긴 하는데 암튼 엄청 꾸덕하고 맛은 있음 다른 맛두 먹어볼예정 여기는 커피도 맛있지만 달달한 케이크가 맛있네요 케이크 종류도 많고 하나씩 다 먹어보고싶어요 장소가 많이 넓은건 아니지만 분위기도 좋고 해서 다음에도 케이크 먹고 싶을때 다시 오려구요 치즈케잌이 꾸덕하니 투박한 느낌의 케잌이 특별해요커븨양은 좀 더 많았음하는 바람이 비쥬얼갑 케이크 수유에서충남까지 힘들게 공수해왔어요 믿고 먹는 치케 무너미 시즌마다 종류도 다르고 다양해서 너무 좋아용 케이크 종류가 다양해서 좋고 피스타치오케이크 고소하고 치즈맛도 많이 나고 맛있어요 주문한 메뉴  아이스 아메리카노 3600원  아이스 바닐라라떼 4400원  딸기타르트 7,"[1, 1, 1, 1, 0, 0, 0, 0]"
233,서울특별시,강북구,수유동,노르웨이안우드,"서울 강북구 도봉로87길 32-6 1,2층",새로나온 바나나피칸 케이크가 나왔다길래 달려왔습니다 바나나만 먹으면 아쉬워서 레몬케이크까지 주문했습니다거기에 상큼한 자몽에이드랑 고소한 롱블랙티도 시켰는데 케이크랑 잘어울려서 놀랬습니다 안마셔봤던거라 고민했는데 너무 좋은 선택이었어요 매장 분위기도 조용하고 아늑해서 수다도 1시간정도 떨었네요허허 그리고 매번 올때마다 사장님께서 친절하게 반겨주셔서 기분이 좋아져요 감사합니다 수유에 이렇게 예쁜 카페가 평일낮인데도 사람이 많았어요 여자들이 좋아할만한 감성카페네요  스콘과 고민하다 시그니처 메뉴라 하길래 빅토리아케이크 주문했어요 딸기잼과 버터딸기의 조합이 맛없을수가 없어요  완전 맛있고 함께 주문한 크림커피도 맛있었어요 스콘먹으로 또 갈께요 우이동 419 공원 주변에 있을 때부터 스콘이 생각날 때면 종종 즐겨찾았던 스콘맛집 수유역근처로 이전후 간만 방문한 곳 런던베이글 뮤지엄 스탈의 인테리어와 4월 한정 스콘이 아주 맘에 들어 폭풍쇼핑했네요 주차장이 없다는 게 조금 아쉬우나 우리는 강북구청 공영주차장을 과감하게 이용했네요 굿굿 겨울이라 그런지 딸기가 들어가는 디저트가 먹고 싶더라구요 그래서 수유역에 온 김에 디저트집 검색해서 찾아왔어요 무엇보다 왕딸기가 올라가는 빅토리아 케이크가 죤맛 좀 단단한 식감에 버터가 듬뿍 올라가서 묵직한 맛이 베이스인데 라즈베리 특유의 새콤한 맛과 왕딸기의 쥬씨함이 잘 어울립다 굿굿 카페 넘 분위기 있고 음료도,"[0, 0, 1, 1, 0, 0, 0, 0]"
234,서울특별시,강북구,수유동,paulette,서울 강북구 한천로139길 25 401호,친절하고 다양한 디저트가 가득한 감성적인 카페입니다 이야기 하기 좋은 카페입니다 테이블옆에 콘센트도 있어서 간단한 작업을 하기도 좋아보였어요 날 좋은날 야외테라스도에서 시간을 보내도 참 좋을 것 같아요  포장도 너무 꼼꼼히 잘해주시고 디저트를 담는 그릇들도 다 깨끗했어요 추천합니다 건물 올라가면서 여기가 맞나 싶은데 맨윗층 올라가는 순간 딴세상이에요  옥상 테라스가 작은 정원처럼 예쁘게 꾸며져있어서 날씨좋은날 가시기를 추천합니다 안쪽 내부자리도 꽤 많고요 화장실도 깨끗합니다 커피는 산미가 없어서 개취로는 더 좋았어요 수유에 이런 감성카페가 있어서 너무 좋아요 커피디저트 맛있고 사장님 너무 친절하세요 정말 감성카페라 혼자도 여럿이도 좋을것 같아요 내부도 예쁘지만 특히 빛이 좋은 테라스가 최고에요 자주 갈거같아요 디저트 맛집  오픈더도어 시절부터 오가며 배달 위주로 즐겼는데  가게 이전을 하셔서 일부러 찾아왔어요  정원 분위기 넘 좋아요 날씨 좋고 따뜻할 때 또 방문할게요 음료랑 디저트도 맛나고 조용하고 아담한 카페에요 눈에 잘 안띄어서 아는 사람만 올 것 같아요  공간이 작다보니 큰 소리로 대화는 어려워요 이런느낌이에요 딱 인스타 감성 느낌  외부에도 자리있고 안에도 있어용  인테리어가 엔틱하게 잘되어있는 느낌 밀크티 달지 않게 맛있어요  에그타르트 보들보들하니 맛있어요 인테리어가 예쁘고 커피도 맛있어요 디저트 고르기 힘들었네여  나중,"[0, 0, 1, 1, 0, 0, 0, 0]"
235,서울특별시,강북구,수유동,수유리조트,서울 강북구 노해로8가길 45,인테리어에 신경 많이 쓴듯해요 대나무와 라탄인테리어가 참 예뻐요 음료랑 베이커리도 무난해용동네 젊은이들이 예뻐서 많이 오는 것 같아요 수유리조트 상호명이 신기해서 방문했던 곳 진짜 외관도 너무 이쁘고 카페 내부 인테리어 글램핑 감성의 루프탑까지 최근에 가본 카페중에 제일 이뻣던거 같아요 시그니처인 돌로미티 라떼 아이스크림이랑 너무 잘 어울렸고요 뭐니뭐니 해도 말차 휘낭시에 진짜 짱맛입니다  분위기 맛 너무 좋았던 수유리조트였습니다  분위기 좋고 커피랑 디저트 다 맛있어서 수유 놀러오는 친구들 있으면 무조건 수유리조트로 데려가용 이 사진은 그 전에 왔을 때 찍은 건데 무튼 오늘의 리뷰는 그간 아아만 마셔봤는데 오늘 처음 따아 마셨음 진짜 커피맛이 느껴지는데 여기 원두 이렇게 맛있는지 처음 알았음 적당한 산미 굿 크로플도 존맛 아인슈페너 크림 쫀쫀 진짜 마시쑴 인서타용 카페가 아닌 진짜 음식도 분위기도 좋은 카페 멍멍이랑 같이 갈 수 있어서 좋아요 커피랑 쿠키도 맛있어요 사진 잘 나와서 좋아용 크림모카 커피 강추 테라스가 있어서 너무 좋아요 답답하지않게 바깥에서 바람쐬며 커피마시니까 넘 좋아요 아진심으로 여자 알바인지 직원은 바꿔야겠네요   월요일 11시에 갔는데 너무 불친절  말투는 물론이고 물어본 거에 대답은 왜케 작게 하는지 안들려서 다시 답해달라고 했는데 여전히 작은 짜증섞인 답변이고 계산하고 진동벨카드 줄때도 한 손으로 주고자기,"[1, 0, 1, 1, 0, 0, 0, 0]"
236,서울특별시,강북구,수유동,아카데미하우스,서울 강북구 4.19로 135 아카데미하우스,집과 가까워서 자주 이용해요 근방에서 젤 대형카페이고 주차가 넉넉하게 3시간 반이라 너무 좋아요 직원분들 다 친절하시고 빵도 맛나는데 평일은 엄청 한가한데 주말은 앉을자리 잡는것두 힘들만큼 사람이 많아요   룸을 예약해서 밥을 먹었는데 음식도 다 맛있었어요 그중 제입맛엔 리조또가 짱 룸은 예약금 만원을 걸고 예약가능했고 사용후 다시 환불을 해줫어요 일반실은 10만원이상 특실은 20만원이상 음식이용을 하몀 누구든지 이용할 수 잇는듯해요 뷰가 멋진곳에서 조용히 맛난 식사 잘했습니당 오랜만에 브런치 먹으러 방문했어요 작년에 오픈하고 몇번 방문 했다가 올해는 처음 방문 했네요  오전에 방문을 해서 주차 자리는 여유가 많았고 계속해서 베이커리가 채워지고 있었어요  탁 트인 곳에서 풍경과 도시 모습을 보는건 역시나 즐겁더라구요  오픈초에는 음식을 1층에서 주문하고 윗층에서 식사를 할 경우에 가지고 올라 오기가 불편했는데 카트가 생겨서 음식을 여러개 주문해도 편하게 올라 올 수 있었어요  오랜만에 가서 그런지 메뉴도 좀 줄었고 음식의 맛은 주방장님이 바뀌신건지 초반에 비해 좀 덜하더라구요 다이닝 메뉴 보다는 베이커리 메뉴가 더 맛있어서 다음엔 커피에 베이커리류 먹으러 방문 할 것 같아요 일요일이라 사람이 많을까 걱정했는데 의외로 한가했다 초창기에 있었던 스프를 기대하며 시켜봤는데 짜고 느끼해서 별로였다 브런치도 차라리 빵이 훨씬 저렴하고 맛있게,"[0, 0, 1, 1, 1, 0, 0, 0]"
