,si,gu,dong,name,address,review,label
676,서울특별시,동대문구,신설동,런치백,서울 동대문구 왕산로9길 25 1층,내가 리뷰 단다는 것은 정말 믿고 가도 된다는 곳정말 좋은 곳 아니면 안 답니다솔직히 귀찮잖아요 귀찮은 거 느낄 새도 없이 리뷰 달러 오게 되는 곳 그만큼 좋다는 말씀 이 마성의 공간  바빠도 시간 내서라도 오게 되는 곳  늘 변함없이 따뜻하고 편안하고 입도 즐거운 곳이다 오래오래 있어줘야해요 우리 힐링해야하니까 얼마전에 이동네로 이사와서 적응하고 있는 와중에 카페가 이뻐보여 들어왔는데 세상에나 밴쿠버에서 학창시절을 보낸 저에게 여긴 고향에 온느낌이에요 칠리숲은 캐나다 팀튼에 파는 그느낌이고 파니니도 학교 앞 카페에 팔던 느낌이라 너무 행복하네요  자주 들려 갬성채울께욤 신설동역에서 가장 좋아하는 카페예요  맛있는 파니니랑 커피마시면서 편안하게 시간보낼수있어 정말 좋아요 사장님 친절하시고 누구보다 반갑기 맞아주는 하비가있어서 갈때마다 기분좋아지는곳입니다  반려견하고 방문했어요 브런치 먹고 산책 시작하기 딱 좋았네요 파니니는 다 맛있을 것 같지만 고민끝에 그릴드치즈를 선택했어요 꿀 찍어먹으니 역시나 맛있고 토마토어니언스프은 개운해요 다음에 다른 종류 파니니 하나씩 뿌시러 종종 가야겠어요 직원분도 친절하셔서 기분 좋게 다녀왔답니다 혼자 가서 하나 둘 시키다 보니 3가지 메뉴를 시켰어요 다 못먹으면 포장하면 되니까 ;  강아지 못봐서 아쉬운데 또 가야할 이유가 생겼네요  파니니에 치즈 정말 아낌없이 넣어주셨고 토마토스프 처음먹어보는데 매콤,"[0, 0, 1, 1, 0, 0, 0, 0]"
677,서울특별시,동대문구,신설동,익골,서울 동대문구 천호대로 11-8 익골,한옥을 개조한 커피도 있고 밥도있고 술도 마실수 있는 메인메뉴도 좋고 주전부리과자가 특이하고 맛있어요  개인적으로 좋아하는 신설동 카페 한옥을 개조한 인테리어도 맘에들고요 인절미 크로플은 꼭 먹어야하는 사장님도 친절하세요 사장님과 직원분들 친절한 건 말할 것도 없고 먹느라고 음식 사진을 다 못 찍어 아쉽지만 와인도 음식도 모두 다 맛있고 분위기도 좋고 가격도 좋고 송년회 하려고 여러 군데 알아보다 익골로 정하고 예약한 저로써는 모두에게 예약 잘했다는 칭찬을 받으니 좋았습니다 암튼 모든게 완벽했던 송년회 신년회도 여기로 할까 합니다 분위기도 좋고 맛도 좋아요 한옥카페라서 들어가봤는데 남자사장님 엄청 친절하시고 커피랑 크로플도 괜찮았어요 모두너무 친절하시고 분위기가 좋아요 매장 안쪽으로 자리가 더 있어요 모두 친절하시고 커피 맛있어요 붕어싸만코빙수  신박해요 분위기도 좋고 사장님을 비롯한 직원도 굉장히 친절해서 종종 들러야겠다라고 생각 들게한 곳입니다  동네에서 찾은 소중한 아지트같이 편안합니다 하지만 와인가격이 안드로메다급입니다 호텔에서도 10만원 언더로 판매하는 제품인데 훨씬 더 비쌉니다 광장히 아쉽네요 한병밖에 없어서 한병만 마신게 다행입니다 사장님이 엄청 친절하시고 크로플과 커피 생딸기가 맛있어요 사장님도 친절하시고 분위기가 너무 좋아요우연히 들어간 카페펍 이지만 커피도 맛잇고 치즈안주도 짱 하이볼이 진짜 맛나네요 자주방문 할듯,"[1, 0, 1, 1, 1, 0, 0, 0]"
678,서울특별시,동대문구,신설동,카페림,서울 동대문구 천호대로27길 8-2,오며가며 늘 가고 싶었던 곳인데 감성충만한 기대를 꽉 채워주는 곳 디저트도 맛있고 고양이도 귀엽고 커피도 맛있었다 아기자기해서 요즘 감성에도 잘 맞고 좌석이 손바닥한 마당에도 아마도 예전 창고였을 곳에도 숨어있어 찾는 재미가 있다 벚꽃마카롱 득템을 기대하구 방문했지만 오늘은 없다구하셔서 다른마카롱으로 구매했어요 디자인도 너무 이쁘고 맛있어서 선물용으로도 추천 쉬었다 가기 좋아요 저 쿠키사러 일부러가쟈나요 넘나맛있어요 흑임자 라떼 따듯하게 먹으면 정말 맛있습니다 마카롱도 같이 먹으면 너무 좋습니다 커피가 다 맛있는데 용두라떼가 특히 맛있었어요 친절하세요 인테리어도 멋져요 커피도 디저트도 맛나네요 전에 갔을 때 카페가 너무 예뻐서 친구들 데리구 갔는데사람이 많아서인지 카운터 봐주시는 분이 살짝 불친절하셨어요 공간이 예뻐서 다시 방문했는데 살짝 아쉬웠습니다 2호점이 있다는 말을 들어서 사람 많은 시간대는거기를 이용하셔도 좋을 거 같아욤 배달로만 먹다가 직접 방문했는데 맛있어요 초코쿠키와 마카롱 맛집 커피와 레몬에이드는거들뿐 무슨디져트가 이토록맛나요 마카롱이 이쁘고 맛있어요 조카생일케잌 카페림에서 주문했어요 원하는 그림대로 너무 예쁘게 만들어주셔서 애들이 너무 좋아하네요 손에 묻히지않고 하나씩 꺼내 먹을수있어서 너무좋네요 콜드브루 디카페인 추천해요 디카페인 중 단연 최고 우연히 발견한 예쁜 카페 쿠키도 넘 맛있어욥 제가 갔을땐 고양이 임보중,"[1, 0, 1, 1, 0, 0, 0, 0]"
679,서울특별시,동대문구,신설동,카페콩제,서울 동대문구 한빛로 29 A동 상가1층 101호,카이막 디저트 맛집인 카페콩제 이곳에서 카이막 디저트를 처음 먹어봤는데 꿀이랑 카이막 조합 누가 발견한 걸까요 담백한 맛을 좋아하는 저에게 완전 취향저격이었어요 에스프레소 종류가 다양했는데 커피대신 에스프레소 즐겨 마시는 분들이라면 신설동에 있는 카페콩제 꼭 한 번 가보셔요  카페 좌석이 별로 없긴 한데 그래서 전 더 좋더라구요_ 조용하게 여유를 즐길 수 있어서 아늑하니 좋았어요 커피맛도 디저트도 동네에 이런 카페가 있어서 넘 좋아요 카이막 세트카이막 빵 비스킷 먹고 싶어서 방문했습니다 분위기도 좋고 커피도 맛있었습니다 카이막은 우유맛이 많이 느껴지는 신선한 맛이어서 극호 다음에 한 번 더 브런치 먹으러 방문하고 싶어졌어요 추천합니당 카이막 처음 먹어봤는데 너무 맛있어요 꼬소하고 찐한 우유맛이라 바게트빵이랑 엄청 잘어울리고 콩제커피도 맛있어요  왜 베스트메뉴인지 알 것 같은 맛 _ 인테리어도 감성 넘치고 다음에도 카이막 먹으러 올게요 카이막 디저트 있길래 시켜봤는데 너무 맛있었음 눈이 번쩍떠지는 맛 신설동역 5분 거리에 이렇게 느낌있는 인테리어 카페가 생기다니 너무 좋아요 카페 시그니커 콩제커피도 맛있어요 아인슈페너 맛입니다 카페가 아기자기하고 예뻐요 카이막 파는 곳이 이동네에 많이 없는데 카이막 있어서 넘 맛있게 먹었어요 빵이랑 비스킷 둘 다 주셔서 양도 많았어요 아메리카노도 고소하고 콘파냐도 달콤쌉싸름해서 좋았어요 카이막 먹으러,"[1, 0, 1, 1, 0, 0, 0, 0]"
680,서울특별시,동대문구,신설동,The november 라운지 고대점,서울 동대문구 한빛로 49 래미안엘리니티 상가 118호,너무 좋아요  인테리어도 너무 잘되어 있고  이 동네에 이런 갬성 카페가 생기다니 굿굿  공부하기에도 대화나누기에도 너무 좋아요 와 커피 잘마시다가 프렌치프라이 시키고 기분 잡쳤네요 프라이인데 튀기지않음 오븐에 구움 시즈닝 내취향아닌건 그렇다 치고 이걸 판매하려고 주신게맞나요 감자가 탔거나 속은 덜 데워져서 설익은 감자튀김인데  음식물 쓰레기를 주워먹어도 이것보단 불쾌하지않을것 같아요  안주 괜찮으면 맥주한잔 하고가고싶었는데 그냥 커피만 드세요 분위기 좋아요 카모마일티도 맛있어요 조금은 어두운 조명이지만 나름 분위기가 매력적이네요 개별 책상마다 스탠드 조명도 잘 배치 되어 있고 소파도 편합니다 2층은 더욱 조용해서 집중하기 좋아요 이상한 저질 커플 때문에 아주 불쾌했습니다 애정행각 극혐 나만 알고싶은 곳♡ 커피가 진하고 고소햐서 맛있어용 2층 공부하기 좋아요 카페오픈전부터 오다가다 봤었는데 매장 정말 넓고 좌석이 많이떨어져있어서 대화하기도 좋았어요 24시인거 최고 자리가 넓고 소파가 커서 좋아요 24시간 까페  2층엔 벽쪽으로 노트북하는사람들이쫙있   공기가 새로생긴까페라 두통유발함  매장은 정말 넓어요 커피맛은 쏘쏘 조용하고 집중하기 좋아요 너무 귀한 24시간 카페입니다 불면증 친구 같은 존재 하겐다즈 시리즈 음료도 넘나 맛나요 조명이 은은해서 대화하기 좋아요 목소리가 큰편인데도 소리가 울리지 않아요 가오픈 기간에 가서 안되는 메뉴,"[0, 0, 1, 1, 1, 1, 0, 0]"
681,서울특별시,동대문구,신설동,카페 쏘리낫쏘리,서울 동대문구 왕산로 22 맹그로브 신설 1층 쏘리낫쏘리,요거트볼이 다들 맛있다해서 궁금해서 주문했는데 진짜 맛있어요 신설동역 가까워서 자주 방문하는데 근처 이만한 곳은 없는 것 같아용 홀케이크엔 딸기가 올라가네요 여기 바스크케이크 진짜 맛있어요 그리고 블랙스노우크림커피도 너무 맛있어요 숨은맛집입니다 맹그로브 신설에서 숙박하고 아침으로 요거트랑 커피 마셨어요  요거트 과일도 많이 주고 넘 맛있어요 커피도 정말 맛있습니다 평소 맹그로브에 너무 살아보고싶었는데 이렇게 일층 카페나마 방문해보아요 커피도 너무 맛있구 같이 먹은 블루베리 스콘이랑 합도 너무 좋습니다 무엇보다 자유롭게 작업할 수 있는 공간이 좋네요 라떼랑 그릭요거트볼 맛집이에요 그릭요거트볼 500그람으로 사가고싶었는데 다이어트중이라 많이 못사가는게 아쉽네요 여기 호텔에서 머무르면 이십퍼 할인도 돼서 원래 가격도 비싸지 않게 맛있는 커피와 그릭요거트 먹을 수 있어요 인테리어도 색다르고 커피좋아하는데 전문 바리스타이신지 라떼맛이 특히좋아요노트북 작업 잘하고갑니다 그릭요거트볼 딸기샤인머스캣 요거트볼 적당히 꾸덕해서 맛있어요  근데 제가 느끼기엔 덜 달게 느껴져서 잼이나 청이 추가되면 정말 맛있을 것 같아요 나중에 잼이나 청도 한 번 고려해주셨으면  아 요거트볼 시켰는데 물도 함께 가져다 주시는 친절함까지 요거트볼 간식으로 너무 좋은 것 같아요  블랙스노우크림이랑 애플잼 스콘  맹그로브 사는데 매일 아침마다 건물 전체에 스콘 냄새 나는데 그,"[0, 0, 1, 1, 0, 1, 0, 0]"
682,서울특별시,동대문구,신설동,카페 어텐디,서울 동대문구 왕산로 110 카페어텐디,오늘은 얼그레이파운드케이크   꾸덕한 식감을 좋아해서 치즈케이크 파운드케이크 스콘 등등 좋아해요   어텐디 얼그레이 스콘 지이이인짜 좋아해서 자주 먹는데 이번에는 파운드로 먹어봤는데 역쉬 맛있군용 밀크티 미쳤습니다 원액 사다가 집에서 우유랑 섞어 마시는 것도 강추 스콘이랑 각종 베이커리 메뉴들도 다 맛있어요 누네띠네 스콘 존맛탱 얼그레이 들어간 메뉴들이 빵 밀크티 가릴 것 없이 다 맛있어요 매장이 협소해서 좌석은 몇 개 없지만 사진은 매우 잘나와요 빵수니는 오늘도 보물같은 맛집 발견하고 기뻐서 웁니다 어텐디 성지순례 마지막지점으로 구겔호프가 아른거려 제기동지점 카페어텐디로 방문했어요 한남지점 북촌지점 다 가봤는데 한남지점엔 구겔호프가 없더라구요   그래서 회사근처인 제기동역에있는 어텐디에 들려서  퇴근후에 먹었는데 너무 맛있었어요 저는 개인적으로 케이크도 맛있지만  구겔호프 완전 꾸덕하고 맛있어요 안에 크림도 가득차서 싱겁지않고 맛나요  각각 지점다 인테리어가매력있고 좋지만 제기동역지점 자주갈예정입니다♡♡♡ 미니사이즈지만 기분낼수있어서 조아요 이 근처에서 제일 유명한 디저트집이에요  모든 메뉴가 다 맛있어서 회사에서 단체 주문도 많이 한다는 걸 최근에야 알았네요  집 가까이에 있어서 너무 좋아용  디저트 맛집이에요 스콘 종류 엄청 많아서 뭐 먹을지 행복한 고민하는 곳  얼그레이 스콘에 아아 조합 최고네용 매장 내부는 좁지만 먹고 갈 ,"[0, 1, 1, 1, 0, 0, 0, 0]"
683,서울특별시,동대문구,신설동,스타벅스 신설동역점,서울 동대문구 왕산로 19,신설동역 3번 출구 스타벅스 입니다 단층 구조지만 공간을 넓게 쓰고 있어요 넓직한 테이블이 오픈된 장소에 있고 카운터를 돌아 가면 또 다른 테이블과 의자들이 있습니다 화장실은 후문으로 나가서 조금만 걸으면 나오는데 깔끔한 편이에요 콘센트도 제법 있어서 카공족 분들께도 추천합니다 노랭이 써모스 보온병 샀는데 영수증 달랬는데 직원분이 안주시더라구요 환경위해 포장 안해주는거까진 참는데 에코백도 안주고 아쉽네요 자동차모양 카드가 이뻐 하니 충전도 해봤어요 이 매장은 손님이 아침부터 많았어요 아이스 돌체라떼 좋아요 편하고 친절하고 좋습니다 편안하게 잘 마시고 쉬어갑니다 신설동역이랑 가깝고 좌석도 넓고 쾌적합니다 자리도 넓고 좋아요 추가 주문하려고 트레이 일부러 가져가서 여기다 달라고 했더니 굳이 새거로 준다고 저기다 가져다 놓으라고    먹던 컵에 물 좀 요쳥했더니 그냥 주면되지 굳이 새컵에 준다고 컵은 가져가란다 거기서 본인이 가져가면 되지 굳이 분리대쪽에 놓으라고    아니 자기들이 어짜피 수거해서 정리해야할텐데 진짜 너므 한심해서 리뷰 씀 자바칩 플라치노 맛있어요 기프티콘 선물 받은거 쓰기 좋아여 진하고 맛있었어요 스벅치고 사람 없어서 좋고  화장실도 청결해서 좋아요 두번째 사먹음  커피도 매장도 다 맘에 듭니다  매장이 넓진 않지만 직원분들 친절하셔서 조아용 좌석문제만 해결되면 최고일텐데  햇살좋은 주말 오후에 ● 아늑한 분위기의 스타,"[1, 0, 1, 0, 1, 1, 0, 0]"
684,서울특별시,동대문구,신설동,메가MGC커피 신설동역점,서울 동대문구 한빛로 1,메가커피는 국룰 귀엽게 얼굴도 그려주시네요 직원분이 친절하세요 좋아요 저렴하고 다양해요  다른 카페보다 가격도 싸고 맛있어서 자주 이용합니다 불친절해요 표정도썩고 딱맞는 세트가 없었지만 친절하게 맞춰서 주문 도와주셨네요 커피 싸고 맛있어용 커피 빠르고 맛있어요 테이크아웃하기좋음 음류수가 맛있고 가성비가 좋아요 그리고 직원들이 친절해요 저녁시간이라 사람 많았는데 직원 언니가 진짜 손도 빠르고 순환률 빨라서 주문 많았는데 대기 시간 길지 않고 빠르게 받았어요    화이팅입니당  음료 포장했는데 친절하시고 좋아요 좋아요 가성비가 좋아요 가격 저렴한만큼 맛도 딱 그정도구요  알바생은 서비스 조금 부족한것 같아요 바빠서 그러신지 아침에 가끔 메가오더를 꺼놔서 그게 좀 불편한거 말고는 좋아요 큐브라떼는 좀 그래요 아이스커피가 진리 가격저렴 조금 더 인상하고 맛있는 원두로 바꾸면 좋겠어요 스무디 맛있네요 민트는 개별취향 친절하시구 좋아요 잘 이용 중 근데 출근시간에 너무 붐비는데 스마트오더가 늘 준비중으로 불가해서 그 점 좀 보완됐으면 합니다 지나며 차 세우고 주문했는데 빠르게 응대해주시고 좋았음 허니자몽블랙티 자몽청 씹을 때 오래된 냄새가 나요 아아 라떼가 맛있어요 투샷 진하고 양도 많아 가성비 최고입니다 좋아요 좋아요 좋아요 전 여기서 라떼 밖에 안 마셔요 커피도 적당히 찐해서 고소하고 맛있어요 착한 가격 맛난 커피 직원분들도친절하시고가성비에,"[1, 0, 1, 0, 0, 0, 1, 0]"
685,서울특별시,동대문구,신설동,메이크데이,서울 동대문구 난계로30길 28-7,왕딸기 생크림 케이크 너무 맛있어요 얼그레이 좋아하시는 분들은 노을 얼그레이도 같이 드셔보세요 라떼아트 귀여워요 창밖에 공원뷰가 멋지네요 커피 디저트 맛있어요 인테리어도 대박이에욤  풍물시장 구경왔다가 저녁 먹고 카페 검색해서 왔습니다 커피도 맛있고 딸기생크림케잌도 맛나네요 커피맛도 괜찮고 매장시 깔끔해서 좋네요 집 근처 카페를 찾다가 우연히 들어왔는데 커피도 너무 너무 맛있고 특히 이 딸기 케이크가 너무 맛있어요  세상 사람들 모두 이 케이크 맛을 알았으면 좋겠습니다  사장님 번창하세요  딸기 생크림 케이크 맛집이에요 커피 크림이 맛있어요 딸기케이크 먹었어요 빵도 부드럽고 크림도 맛있네용 고소하면서 달달한 느낌 커피는 모르겟고 크로플이 맛잇네요 여기 진짜 크로플 맛집  흑임자라떼 맛집이라고 나와서 찾아갔는데 흑임자 크림이 쫀쫀하고 달다구리한 게 맛있네요  사장님도 친절하시고 매장도 깔끔해용 커피두 맛있고  분위기 넘 좋아용   집앞이라 자주가는데 사장님두 넘 친절하세요  크로플 위에 아이스크림 너무 맛있어요 담에가면 또 먹을거예요 다들 드셔보세용 추천이용 커피 맛있어요 생각나는 맛이고 한번씩 찾게 됩니다 크로플이 맛있고 카페분위기도 굿 커피가 지인짜 맛있어요 카페는 작지만 제값하는 카페입니다 커피 맛있고 친절합니다 회사 근처라 종종 이용하는 카페입니다 연유라떼맛있어요 흑임자라떼 맛있어요 종종 방문하는 곳입니다 커피가 맛있어요 커피가,"[1, 0, 1, 1, 0, 0, 0, 0]"
686,서울특별시,동대문구,제기동,스타벅스 경동1960점,서울 동대문구 고산자로36길 3,경동시장 3층에 있는 매장으로 금성전파사라는 곳을 통하여 입장 가능합니다 2층입구에서 친절하게 스타벅스 위치를 안내해주시구요 예전에 영화관이였던 곳을 개조한 느낌을 받는 곳으로 매장 특화 된 메뉴를 주문 할 수 있습니다 더 쑥 그린 블랜디드가 대표적 음료인 듯 합니다 쑥향이 은은한게 좋고 미숫가루 맛을 좋아한다면 강추하는 메뉴입니다 무엇보다 대표적인 푸드는 매장에서 직접 베이킹하는 크로와상류인 듯 합니다 어니언 크림 바질롤은 바질향이 은은하면서 달달한 크림이 특징인 메뉴인 듯 합니다 직접 베이킹하는 대부분의 빵류가 달달하여서 커피와 함께 디저트류로 맛있게 드실 수 있을 듯 합니다 특히 매장 픽업대에서 도와주시는 분이 상당히 친절하시면서 눈빛도 청명하고 명랑하게 안내해주셔서 최고 였습니다 와 제주디저트 왜 경동점엔 있어요다른지점도 있으면 좋겠다  흙 그렇게 유명한 유명한 이유 알겠네요 진짜 인테리어 짱이고 디저트도 너무 맛있어요 단호박크림치즈브레드 그거꼭먹어보세요 짱맛 과일사러 청량리시장에 가는 길에 핫플입성 사람들한테 기빨리는 스탈이라 핫플 잘 안가는데 시장에 어차피 과일사러 가야해서 함 가봤습니다  핫플될 만 하네요 인테리어 멋집니다 구닥다리 느낌이 아니고 옛날 감성이면서 현대적느낌의 조화가 좋아요 좌석도 편하네요  콜드브루 오트라떼와 펌킨 크림치즈 브레드 먹었는데 맛있어요 오트라떼는 좀 달긴했는데 안달았어도 좋았을 뻔했습니다 빵은,"[0, 0, 1, 1, 1, 1, 0, 0]"
687,서울특별시,동대문구,제기동,카페 청량,서울 동대문구 홍릉로3길 18 1층,음료 디저트 예쁘게 나와서 좋았어요 카페 청량 들어가는 입구부터 뭔가 갬성있고요 평일이라서 배달이 지진짜 많더라구요 딸기 음료 시켰는데 진짜맛있었어요 친구들 음료도 다 맛있대요 특히 초코케이크가 찐많이 달지않고 너무 개인취향저격 여기 직원분들 정말 너무 친절하게 대해주셔서 기분좋았어요♡ 감사합니다♡♡대만족하고 온 카페♡♡ 번창하세용 리뷰 잘 안쓰는데 쓰게되는 카페네요 분위기 좋구 아늑해요 오랜만에 맘에드는 카페였어요 커피 맛 괜찮고 디자트는 담에 먹어봐야겠어요 일반 케이크 아닌 갸또 꾸덕해보여서 먹고싶어졋어요 야외테러스도 잇어서 좋네요 재방문 할듯해요 일단 커피랑 디저트가 맛있어요 인스타 감성으로 꾸며놓으시고노래 선곡도 좋더라구요 사람도 은근 많이들 오는데 의자가 좀 불편하긴 하네요 그래도 갬성 인테리어인 만큼 참을만 했습니다 할머니냉면 먹으러가따 오는길에 새로 생긴 카페여서 가보았는데 아메리카노 고소하고 산미도 있고 맛있습니다 인테리어와 조명도 예쁘게 잘해놨구요 해가 잘 들어와서 따뜻합니다 사장님도 친절합니다 청량리 시장 골목에 새로 생긴 카페 입니다 주변에서 냉면 한 그릇 때리고 방문해서 딸기 쥬스 먹으면 괜찮아요 주변에서 과일 사와서 장사하신다고 하니 과일 신선도도 괜찮은 편입니다 조금 쌩뚱맞은곳에 있지만;; 너무 친절하고 맛있네요 공간은 좁지만 분위기 좋아요 커피가 맛있어서 청량리 간김에 또 방문했어요 바닐라라떼도 넘 맛있습니,"[1, 0, 1, 1, 0, 0, 0, 0]"
688,서울특별시,동대문구,제기동,래디컬브루잉클럽,서울 동대문구 안암로20길 7-12 1층,분위기 맛 친절 너무 좋았던 곳이에요 과테말라 엘 소코로 는 정말 설명처럼 고소하고 땅콩버터 향이 났구요 콜롬비아 로즈 부케 는 히비스커스 향이 은은히 나면서 부담스럽지 않은 산미였어요 두가지 조합이 너무 좋았습니다  마지막으로 주문한  요 음료 음료 이름이물음표 도 넘 매력적이더라구요 곶감라떼 인데 색다르고 설탕 씹히는게너무 좋았어요 엘피도 저희가 부탁드린거 흔쾌히 틀어주시고노래와 커피가 너무 잘어울리는 곳입니다 매일매일 오고싶어요 필터커피 종류가 주기적으로 바뀌고 통창인데도 생각보다 좌석이 불편하지 않음 필터마다 고유의 맛이 달라서 주기적으로 방문해보길 추천 고대 맞은편 골목의 카페로 맛있다는 후기가 많아 방문했다 골목 구석에 있는데 간판이 크지않아 입구 찾는데 조금 혼란스러웠고 위치가 찾기 약간 어렵다 크림라떼를 주문했는데 기대이상으로 맛있다 약간 샷이 섞인 크림이 아이스크림같은 느낌이라 아포카토를 녹여먹는 맛이 난다 커피는 산미가 높아서 취향은 아니지만 크림과 섞으면 꽤 괜찮다 가격이 비싼데 비해 양은 별다방 더블샷 사이즈라 작고 소중하지만 밍밍한 저가커피 대용량으로 먹느니 이거 한 잔을 퀄리티있게 마시겠다 크림라떼라 먹고나서 살짝 느끼해질 수는 있음 유명 카페의 원두를 사용해서 에어로프레스로 추출하는 브루잉커피도 좋고 슬레이어에서 뽑는 에쏘기반 커피도 나무랄데 없이 좋으나 너무 늦은 제공시간이 아쉽습니다 인스타보구 신메뉴 크,"[1, 0, 1, 1, 0, 0, 0, 0]"
